{
  "apiVersion": "gcac.adapter/v1",
  "adapterId": "artifact-codec.pem",
  "version": "1.0",
  "kind": "artifact_codec",
  "consumes": ["certificate.version"],
  "produces": ["certificate.material.pem"],
  "requirements": {
    "id": "artifact-codec.pem.requirement",
    "ownerType": "provider_action",
    "ownerId": "artifact-codec.pem",
    "requiredAll": [
      {
        "capabilityKey": "tls.local_verify",
        "operator": "equals",
        "expected": true,
        "reason": "需要验证证书、私钥和证书链",
        "riskIfMissing": "无法确认 PEM 材料可以安全部署"
      }
    ],
    "optional": [],
    "anyOfGroups": [],
    "forbidden": [],
    "minConfidence": 80,
    "allowManual": false,
    "riskLevel": "high"
  },
  "conflicts": [],
  "priority": 100,
  "riskLevel": "high",
  "supportedOperationSchemas": ["1.0"]
}
