{
  "apiVersion": "gcac.adapter/v1",
  "adapterId": "product.tomcat",
  "version": "1.0",
  "kind": "product",
  "consumes": ["certificate.material.pem", "certificate.material.pkcs12", "certificate.material.jks"],
  "produces": ["operation.tomcat.connector.update"],
  "requirements": {
    "id": "product.tomcat.requirement",
    "ownerType": "provider_action",
    "ownerId": "product.tomcat",
    "requiredAll": [
      { "capabilityKey": "tomcat.server_xml.parse", "operator": "equals", "expected": true, "reason": "需要解析 Tomcat Connector 和 SSLHostConfig", "riskIfMissing": "无法定位 TLS Connector" },
      { "capabilityKey": "tomcat.keystore.replace", "operator": "equals", "expected": true, "reason": "需要替换 Tomcat 密钥库或证书材料", "riskIfMissing": "无法完成部署" }
    ],
    "optional": [], "anyOfGroups": [], "forbidden": [], "minConfidence": 80, "allowManual": false, "riskLevel": "critical"
  },
  "conflicts": [], "priority": 100, "riskLevel": "critical", "supportedOperationSchemas": ["1.0"]
}
